{
  "contract": {
    "name": "research-os/artifact",
    "version": "1.1.0"
  },
  "target": {
    "kind": "uri",
    "uri": "https://example.org/data.json",
    "sha256": "aaaaaaaaaaaaaaaaaaaaaaaaaaaaaaaaaaaaaaaaaaaaaaaaaaaaaaaaaaaaaaaa"
  },
  "type": {
    "name": "example",
    "version": "1.0.0"
  },
  "spec": {}
}
