{
  "contract": {"name": "research-os/artifact", "version": "1.1.0"},
  "target": {"kind": "git", "path": "inputs/research-question.json"},
  "type": {"name": "research-question", "version": "1.0.0"},
  "spec": {
    "question": "State the fixed research question.",
    "boundaries": ["State at least one explicit in-scope or out-of-scope boundary."],
    "success_criteria": [],
    "budget": {},
    "invariants": []
  }
}
